{
  "$schema": "http://json-schema.org/draft-07/schema#",
  "title": "EndpointPilot Registry Operations",
  "description": "Schema for EndpointPilot registry operations",
  "type": "array",
  "items": {
    "type": "object",
    "properties": {
      "id": {
        "type": "string",
        "description": "Unique identifier for the registry operation"
      },
      "name": {
        "type": "string",
        "description": "Registry value name"
      },
      "path": {
        "type": "string",
        "pattern": "^HKEY_[A-Z_]+\\\\.*",
        "description": "Registry key path"
      },
      "value": {
        "type": "string",
        "description": "Registry value"
      },
      "regtype": {
        "type": "string",
        "enum": ["string", "dword", "qword", "binary", "multi-string", "expandable"],
        "description": "Registry value type"
      },
      "write_once": {
        "type": "string",
        "enum": ["true", "false"],
        "description": "Whether to write the registry value only once"
      },
      "delete": {
        "type": "boolean",
        "description": "Whether to delete the registry value"
      },
      "targeting_type": {
        "type": "string",
        "enum": ["none", "group", "computer", "user"],
        "description": "Type of targeting to apply"
      },
      "target": {
        "type": "string",
        "description": "Target for the operation"
      },
      "requiresAdmin": {
        "type": "boolean",
        "default": false,
        "description": "Whether this operation requires administrative/SYSTEM privileges"
      },
      "adminContext": {
        "type": "string",
        "enum": ["user", "system", "auto"],
        "default": "auto",
        "description": "Execution context when admin is required"
      },  
      "_comment1": {
        "type": "string",
        "description": "Comment field 1"
      },
      "_comment2": {
        "type": "string",
        "description": "Comment field 2"
      }
    },
    "required": ["id", "name", "path", "regtype", "targeting_type", "target"],
    "additionalProperties": false,
    "allOf": [
      {
        "if": {
          "properties": {
            "delete": { "enum": [false, null] }
          }
        },
        "then": {
          "required": ["value"]
        }
      }
    ]
  }
}